### ISSUE TITLE
have to keep running arping to keep the VIP alive

### ISSUE THREAD

**Issue by j-devops** [danderson/metallb#259]
**Is this a bug report or a feature request?**:
Bug report

**What happened**:
Have to send a gratious arp to keep the VIP working outside of local switch

**What you expected to happen**:
Gratuitous arps should be handled inside metallb? Is something not running?

**How to reproduce it (as minimally and precisely as possible)**:
1.  Create a loadbalancer service using L2 approach;
ingress-nginx   nginx                  LoadBalancer   10.107.78.38     172.29.30.100   80:30462/TCP,443:30626/TCP           1d        app=ingress-nginx

2.  Try to ping outside local switch

**Anything else we need to know?**:
workaround:
arping -U 172.29.30.100 -I ens785

Have to run every half day or so.

**Environment**:
- MetalLB version: latest
- Kubernetes version: 1.10.2
- BGP router type/version: unknown / using L2
- OS (e.g. from /etc/os-release): centos 7.4
- Kernel (e.g. `uname -a`): Linux moby1 3.10.0-693.el7.x86_64 #1 SMP Tue Aug 22 21:09:27 UTC 2017 x86_64 x86_64 x86_64 GNU/Linux

**Comment by danderson** [comment]
Ping does not work at all for MetalLB IPs, because Kubernetes only routes traffic for the specific exposed ports on the IP. Are you also getting connectivity failures talking to the service port(s)?

Gratuitous ARP is only required during failover between machines, to update the switch port mappings. Normal client/server communication happens via a normal ARP exchange (client sends who-has, MetalLB responds is-at, traffic flows).

If the service ports are unreachable, that means something is going wrong with the ARP communications. To debug that more, we'll need a bunch of things.

First, what is your network topology? Sounds like you have multiple devices between the client and the cluster, please give me a map of the various switches and routers. If your k8s cluster nodes have multiple physical interfaces, or if they run on a virtualization platform, that may be relevant as well.

Next, wait for the service to be unreachable (and don't "fix" it with arping, we need to diagnose while the system is borked). Then, on the client:

- `curl -v http://172.29.30.100`. Does it time out? Fail with some other error?
- Paste me the output of `ip neigh show 172.29.30.100`
- Run `sudo tcpdump -i any arp`, and in parallel run the `curl` command again. Please include the output from tcpdump. You should see who-has and is-at traffic for 172.29.30.100, is it there?

On the server side:

- Identify the MetalLB leader node: `kubectl get ep -nmetallb-system metallb-speaker -oyaml`. Under annotations, you'll find `control-plane.alpha.kubernetes.io/leader`, and in the text that follows, `holderIdentity` tells you which node is the current leader.
- Find the speaker pod for that node: `kubectl get po -nmetallb-system -owide`.
- Dump the logs for that pod, and paste them to me: `kubectl logs -nmetallb-system <pod name>`

I think that's it to start with... Given that many people are successfully using MetalLB in layer2 mode without seeing this problem, we need to find what is different about your setup compared to everyone else's. The data above will hopefully help us narrow down what is happening.

**Comment by danderson** [comment]
Thanks for the logs. I see the right messages that say speaker has configured itself to announce the IP. One thing I see that's strange is that there are no `createARPResponder` events in the log. If the logs are complete, that means the speaker isn't listening on any network interfaces.

Can you check if there's any log entries that mention `createARPResponder` in any way for that speaker?

Also, can you paste the output of `ip addr show` on moby1? I'd like to see if anything stands out that might cause the speaker to not select interfaces for listening.

**Comment by zerobane** [comment]
[root@moby1 cron.hourly]# ip addr show
1: lo: <LOOPBACK,UP,LOWER_UP> mtu 65536 qdisc noqueue state UNKNOWN qlen 1
    link/loopback 00:00:00:00:00:00 brd 00:00:00:00:00:00
    inet 127.0.0.1/8 scope host lo
       valid_lft forever preferred_lft forever
    inet6 ::1/128 scope host
       valid_lft forever preferred_lft forever
2: enp5s0f0: <NO-CARRIER,BROADCAST,MULTICAST,UP> mtu 1500 qdisc mq state DOWN qlen 1000
    link/ether 00:1e:67:df:fc:3f brd ff:ff:ff:ff:ff:ff
3: enp5s0f1: <BROADCAST,MULTICAST,UP,LOWER_UP> mtu 1500 qdisc mq state UP qlen 1000
    link/ether 00:1e:67:df:fc:40 brd ff:ff:ff:ff:ff:ff
4: ens785: <BROADCAST,MULTICAST,UP,LOWER_UP> mtu 9216 qdisc mq portid e41d2d0300e56e50 state UP qlen 1000
    link/ether e4:1d:2d:e5:6e:50 brd ff:ff:ff:ff:ff:ff
    inet 172.29.30.14/24 brd 172.29.30.255 scope global ens785
       valid_lft forever preferred_lft forever
    inet6 fe80::e61d:2dff:fee5:6e50/64 scope link
       valid_lft forever preferred_lft forever
5: ens785d1: <NO-CARRIER,BROADCAST,MULTICAST,UP> mtu 1500 qdisc mq portid e41d2d0300e56e51 state DOWN qlen 1000
    link/ether e4:1d:2d:e5:6e:51 brd ff:ff:ff:ff:ff:ff
6: docker0: <NO-CARRIER,BROADCAST,MULTICAST,UP> mtu 1500 qdisc noqueue state DOWN
    link/ether 02:42:16:45:f7:5d brd ff:ff:ff:ff:ff:ff
    inet 172.17.0.1/16 brd 172.17.255.255 scope global docker0
       valid_lft forever preferred_lft forever
    inet6 fe80::42:16ff:fe45:f75d/64 scope link
       valid_lft forever preferred_lft forever
34: br-bd4fec847a59: <NO-CARRIER,BROADCAST,MULTICAST,UP> mtu 1500 qdisc noqueue state DOWN
    link/ether 02:42:03:32:f9:73 brd ff:ff:ff:ff:ff:ff
    inet 172.18.0.1/16 brd 172.18.255.255 scope global br-bd4fec847a59
       valid_lft forever preferred_lft forever
    inet6 fe80::42:3ff:fe32:f973/64 scope link
       valid_lft forever preferred_lft forever
41: flannel.1: <BROADCAST,MULTICAST,UP,LOWER_UP> mtu 9166 qdisc noqueue state UNKNOWN
    link/ether a2:0b:ef:9c:08:69 brd ff:ff:ff:ff:ff:ff
    inet 10.244.0.0/32 scope global flannel.1
       valid_lft forever preferred_lft forever
    inet6 fe80::a00b:efff:fe9c:869/64 scope link
       valid_lft forever preferred_lft forever
[root@moby1 cron.hourly]#

**Comment by zerobane** [comment]
[root@moby1 cron.hourly]# cat a.out | grep -A2 -B2 createARPResponder
{"branch":"HEAD","caller":"main.go:63","commit":"bd678827","msg":"MetalLB speaker starting version 0.6.2 (commit bd678827, branch HEAD)","ts":"2018-05-08T19:17:45.57370553Z","version":"0.6.2"}
{"caller":"leaderelection.go:174","level":"info","msg":"attempting to acquire leader lease...","ts":"2018-05-08T19:17:45.668858Z"}
{"caller":"announcer.go:88","event":"createARPResponder","interface":"enp5s0f0","msg":"created ARP responder for interface","ts":"2018-05-08T19:17:45.78133969Z"}
{"caller":"announcer.go:88","event":"createARPResponder","interface":"enp5s0f1","msg":"created ARP responder for interface","ts":"2018-05-08T19:17:45.789979245Z"}
{"caller":"announcer.go:88","event":"createARPResponder","interface":"ens785","msg":"created ARP responder for interface","ts":"2018-05-08T19:17:45.795991514Z"}
{"caller":"announcer.go:97","event":"createNDPResponder","interface":"ens785","msg":"created NDP responder for interface","ts":"2018-05-08T19:17:45.796586218Z"}
{"caller":"announcer.go:88","event":"createARPResponder","interface":"ens785d1","msg":"created ARP responder for interface","ts":"2018-05-08T19:17:46.067194798Z"}
{"caller":"announcer.go:88","event":"createARPResponder","interface":"docker0","msg":"created ARP responder for interface","ts":"2018-05-08T19:17:46.07696737Z"}
{"caller":"announcer.go:88","event":"createARPResponder","interface":"flannel.1","msg":"created ARP responder for interface","ts":"2018-05-08T19:17:46.082969946Z"}
{"caller":"announcer.go:97","event":"createNDPResponder","interface":"flannel.1","msg":"created NDP responder for interface","ts":"2018-05-08T19:17:46.083154694Z"}
{"caller":"main.go:162","event":"startUpdate","msg":"start of service update","service":"kube-system/tiller-deploy","ts":"2018-05-08T19:17:46.768771818Z"}
--
{"caller":"main.go:162","event":"startUpdate","msg":"start of service update","service":"cje2/cjoc","ts":"2018-05-09T20:22:00.060364904Z"}
{"caller":"main.go:166","event":"endUpdate","msg":"end of service update","service":"cje2/cjoc","ts":"2018-05-09T20:22:00.060501904Z"}
{"caller":"announcer.go:88","event":"createARPResponder","interface":"cni0","msg":"created ARP responder for interface","ts":"2018-05-09T20:22:07.792997607Z"}
{"caller":"announcer.go:97","event":"createNDPResponder","interface":"cni0","msg":"created NDP responder for interface","ts":"2018-05-09T20:22:07.79329705Z"}
{"caller":"announcer.go:88","event":"createARPResponder","interface":"vethb35b2818","msg":"created ARP responder for interface","ts":"2018-05-09T20:22:07.801952162Z"}
{"caller":"announcer.go:97","event":"createNDPResponder","interface":"vethb35b2818","msg":"created NDP responder for interface","ts":"2018-05-09T20:22:07.80211879Z"}
{"caller":"main.go:162","event":"startUpdate","msg":"start of service update","service":"cje2/cjoc","ts":"2018-05-09T20:22:18.758358224Z"}
[root@moby1 cron.hourly]#

**Comment by danderson** [comment]
Okay, so that all looks fine... Based on the interface names, I'm assuming this is a physical machine and not a VM, right?

One more thing we could check without waiting for the service to fail:
- On your client, run `arping -I <interface> 172.29.30.100`.
- On the client, run `tcpdump -i any arp`, and check if you see both the request (`who-has`) and the response (`is-at`).
- Simultaneously, in the speaker logs, check if you see log entries that contain "got ARP request".

Based on which (if any) of these steps show missing packets, that might help us narrow down what's going on.

**Comment by zerobane** [comment]
Yes; physical machine; 30+ node intel HPC cluster, baremetal deploy of
centos 7.4.


note: cje1 = 172.20.30.100

cpdump: verbose output suppressed, use -v or -vv for full protocol decode

listening on any, link-type LINUX_SLL (Linux cooked), capture size 65535
bytes

21:05:40.611978 ethertype ARP, ARP, Request who-has r0s1i0 tell r0_smw_gw,
length 46

21:05:40.691159 ARP, Request who-has cje1.dev.test.com (00:00:5e:00:01:30
(oui Unknown)) tell soly-smw.us.test.com, length 28

21:05:40.694236 ARP, Reply cje1.dev.test.com is-at 00:00:5e:00:01:30 (oui
Unknown), length 46

21:05:41.611664 ethertype ARP, ARP, Request who-has r0s1i0 tell r0_smw_gw,
length 46

21:05:41.691245 ARP, Request who-has cje1.dev.test.com (00:00:5e:00:01:30
(oui Unknown)) tell soly-smw.us.test.com, length 28

21:05:41.691548 ARP, Reply cje1.dev.test.com is-at 00:00:5e:00:01:30 (oui
Unknown), length 46

21:05:42.611600 ethertype ARP, ARP, Request who-has r0s1i0 tell r0_smw_gw,
length 46

21:05:42.691295 ARP, Request who-has cje1.dev.test.com (00:00:5e:00:01:30
(oui Unknown)) tell soly-smw.us.test.com, length 28

21:05:42.691597 ARP, Reply cje1.dev.test.com is-at 00:00:5e:00:01:30 (oui
Unknown), length 46

21:05:42.957842 ARP, Request who-has soly-smw tell nid00006.local, length 46

21:05:42.957842 ARP, Request who-has soly-smw tell nid00006.local, length 46

21:05:42.957858 ARP, Reply soly-smw is-at 18:66:da:fb:6c:ea (oui Unknown),
length 28

21:05:42.957862 ARP, Reply soly-smw is-at 18:66:da:fb:6c:ea (oui Unknown),
length 28

21:05:43.691392 ARP, Request who-has cje1.dev.test.com (00:00:5e:00:01:30
(oui Unknown)) tell soly-smw.us.test.com, length 28

21:05:43.691738 ARP, Reply cje1.dev.test.com is-at 00:00:5e:00:01:30 (oui
Unknown), length 46

21:05:44.673153 ethertype ARP, ARP, Request who-has r0s2i0 tell r0_smw_gw,
length 46

21:05:44.676025 ethertype ARP, ARP, Request who-has r0s3i0 tell r0_smw_gw,
length 46

21:05:44.691484 ARP, Request who-has cje1.dev.test.com (00:00:5e:00:01:30
(oui Unknown)) tell soly-smw.us.test.com, length 28

21:05:44.692039 ARP, Reply cje1.dev.test.com is-at 00:00:5e:00:01:30 (oui
Unknown), length 46

21:05:45.671629 ethertype ARP, ARP, Request who-has r0s2i0 tell r0_smw_gw,
length 46

21:05:45.675520 ethertype ARP, ARP, Request who-has r0s3i0 tell r0_smw_gw,
length 46

21:05:45.691566 ARP, Request who-has cje1.dev.test.com (00:00:5e:00:01:30
(oui Unknown)) tell soly-smw.us.test.com, length 28

21:05:45.700662 ARP, Reply cje1.dev.test.com is-at 00:00:5e:00:01:30 (oui
Unknown), length 46

21:05:46.671632 ethertype ARP, ARP, Request who-has r0s2i0 tell r0_smw_gw,
length 46

21:05:46.675535 ethertype ARP, ARP, Request who-has r0s3i0 tell r0_smw_gw,
length 46

*I see some got arp requests in logs; but these do NOT update when running
from client.*

{"caller":"main.go:166","event":"endUpdate","msg":"end of service
update","service":"kube-system/kubernetes-dashboard","ts":"2018-05-12T00:07:02.469224526Z"}
{"caller":"main.go:162","event":"startUpdate","msg":"start of service
update","service":"cje-2/cjoc-jnlp","ts":"2018-05-12T00:07:02.469287475Z"}
{"caller":"main.go:166","event":"endUpdate","msg":"end of service
update","service":"cje-2/cjoc-jnlp","ts":"2018-05-12T00:07:02.469338012Z"}
{"caller":"arp.go:102","interface":"enp5s0f1","ip":"172.29.30.100","msg":"got
ARP request for service IP, sending
response","responseMAC":"00:1e:67:df:fd:5d","senderIP":"172.29.30.100","senderMAC":"e4:1d:2d:e5:6e:50","ts":"2018-05-12T00:07:29.737270037Z"}
{"caller":"arp.go:102","interface":"ens785","ip":"172.29.30.100","msg":"got
ARP request for service IP, sending
response","responseMAC":"e4:1d:2d:30:c6:b0","senderIP":"172.29.30.100","senderMAC":"e4:1d:2d:e5:6e:50","ts":"2018-05-12T00:07:29.73726999Z"}
{"caller":"arp.go:102","interface":"ens785","ip":"172.29.30.100","msg":"got
ARP request for service IP, sending
response","responseMAC":"e4:1d:2d:30:c6:b0","senderIP":"172.29.30.100","senderMAC":"e4:1d:2d:e5:6e:50","ts":"2018-05-12T00:07:30.737306385Z"}
{"caller":"arp.go:102","interface":"ens785","ip":"172.29.30.100","msg":"got
ARP request for service IP, sending
response","responseMAC":"e4:1d:2d:30:c6:b0","senderIP":"172.29.30.100","senderMAC":"e4:1d:2d:e5:6e:50","ts":"2018-05-12T00:07:31.737386311Z"}
{"caller":"arp.go:102","interface":"ens785","ip":"172.29.30.100","msg":"got
ARP request for service IP, sending
response","responseMAC":"e4:1d:2d:30:c6:b0","senderIP":"172.29.30.100","senderMAC":"e4:1d:2d:e5:6e:50","ts":"2018-05-12T00:07:32.737457005Z"}
[root@moby1 ~]#




*Jason K Cafarelli*
Desk:   (508) 637-5705 (primary)
Mobile: (508) 215-9712
jason.cae@gmail.com

**Comment by danderson** [comment]
Apologies for disappearing. The last information you provided shows that MetalLB does receive ARP requests, and responds to them. Based on that, it looks to me like MetalLB is working correctly, and that leads me to suspect something in your network infrastructure blocking some kinds of ARP traffic (e.g. some misfiring anti-spoofing logic in switches). Unfortunately I can't really debug that.

Have you seen connectivity failures since the last time we spoke? If so, were you able to get the data in https://github.com/google/metallb/issues/259#issuecomment-388279270 ? That might help us pinpoint the problem better.

**Comment by ElanHasson** [comment]
I am seeing similar behavior.

In my speaker, i'm seeing 
{"caller":"announcer.go:89","event":"createARPResponder","interface":"vethbbd256f9","msg":"created ARP responder for interface","ts":"2018-10-11T01:34:02.165773428Z"}
{"caller":"announcer.go:98","event":"createNDPResponder","interface":"vethbbd256f9","msg":"created NDP responder for interface","ts":"2018-10-11T01:34:02.165970827Z"}

...


however, No arp traffic is being sent.

These are VMs running on my home network.

**Comment by HankTheCrank** [comment]
I wanted to chime in here as I was having the same problem. I now have it solved.

I had both ports on a dual port nic plugged into the nodes. Only one port was being used. When I unplugged the unused port from the network, the problem went away.

**Comment by ananbas** [comment]
Hi, i've got this problem too

**Comment by teralype** [comment]
My problem is a little bit different. Any VIP works for a second or so, then stops working. I think the issue is that all arp-speaker nodes are replying to ARP requests with the same information, and this likely confuses either LACP or the switches. Have anybody seen this behavior?

**Comment by teralype** [comment]
The `arping -I eno1np0 10.200.0.15 -U` trick works for me too, but this is unacceptable. Is there a way to prevent all arp-speakers from replying?

**Comment by danderson** [comment]
This is being used as a dumping ground for support requests, so I'm going to close it. There's many reasons why MetalLB might not work, and they're almost always due to network topology issues or bugs with specific hardware network drivers.
